<?xml version="1.0" encoding="UTF-8"?>

<!ELEMENT coffeedetails (coffeeshop+)>
<!ELEMENT coffeeshop (name,add,cont)>
<!ELEMENT name (#PCDATA)>
<!ELEMENT add (#PCDATA)>
<!ELEMENT cont (#PCDATA)>
<!ATTLIST coffeeshop cid ID #REQUIRED>
